title,description
Will Trudeau resign? All eyes on his political future as pressure mounts - National,Monday could mark a historic week in Canadian politics if the growing chorus calling for the resignation of Prime Minister Justin Trudeau gets its way.
Canada's Trudeau announces resignation after nearly a decade as prime minister,"Canadian Prime Minister Justin Trudeau announced his resignation Monday after nearly a decade in power, bowing to rising discontent over his leadership and grow..."
"FIRST READING: The Trump cabinet really, really hates Trudeau",U.S. administrations usually don't have strong opinions about Canada. Not this time.
Trudeau in Florida to meet with Donald Trump in wake of tariff threat,"Prime Minister Justin Trudeau is in Palm Beach, Fla., to meet with U.S. president-elect Donald Trump."
Amy Hamm: Trudeau condemns us to Wacko purgatory,Poilievre’s video was timed for the election Canadians want but won’t get
Former Canadian Prime Minister Justin Trudeau Mocked Relentlessly After Steamy Session With Katy Perry,The internet is taking aim at Canada's former prime minister Justin Trudeau after he was photographed with his arms wrapped around Katy Perry.
Trudeau: Evidence suggests Ukraine jet shot down by Iran,Canadian Prime Minister Justin Trudeau said evidence suggests a Ukrainian jet with 176 on board was shot down by an Iranian missile. Sixty-three of the victims ...
Justin Trudeau Lost the Plot. Now He’s Looking for a New One,What does a former prime minister do for a second act?
Justin Trudeau to step down as PM following Liberal leadership race,"Prime Minister Justin Trudeau is stepping down as Liberal leader, and is proroguing Parliament as the Liberal Party of Canada embarks on the journey to replace ..."
Terry Newman: What Justin Trudeau isn't saying,"During tariff crisis, Canadians needed more information from the prime minister"
"""Such An Insufferable Tool"": Musk Slams Trudeau Over His Jab At Trump",Elon Musk's reaction came after Justin Trudeau said Kamala Harris's loss in the US presidential election was a setback for women's progress.
"Trump Issues Christmas Message to 'Wonderful Soldiers of China,' 'Governor' Trudeau","President-elect Donald Trump issued a Christmas message to the ""wonderful soldiers of China"" who are ""illegally, operating the Panama Canal."""
Trump calls Florida meeting with Trudeau productive amid stiff tariff threat,WASHINGTON — President-elect Donald Trump called his meeting with Justin Trudeau productive and says the prime minister made a commitment to work with the Uni...
Atlantic Liberal Caucus calls for Trudeau to step down as leader,"Following an Atlantic Liberal Caucus meeting the morning of December 23, caucus chair Kody Blois wrote a letter to Trudeau calling for him to resign as party le..."
"Trudeau less likely to remain leader since Freeland quit, Gerald Butts says",Butts says Chrystia Freeland's resignation dealt Trudeau a staggering blow that loosened his already tenuous grip on the party.
Trump takes aim at Canada and Prime Minister Justin Trudeau,"President-elect Donald Trump this week once again issued several taunts directed at America's largest trading partner, Canada, and Justin Trudeau, its prime min..."
Katy Perry and Justin Trudeau Kiss on the Singer's Yacht,Katy Perry and Justin Trudeau’s summer fling﻿ has survived the test of time and transformed into a fall romance.
Letters: Trudeau and his Liberals hang on for dear life,Letter writers discuss this week's chaos in Ottawa
The loonie is in focus on potential Trudeau resignation,The Canadian dollar is leading the way to start the new week
"Internal pressure was mounting on Trudeau ahead of resignation, N.L. MP says","N.L. MP Ken McDonald, who is among those who called for the P.M.'s resignation, says he's glad Trudeau decided to step down."
Katy Perry Holds Hands With Justin Trudeau on Paris Date for Birthday,Katy Perry was filmed holding hands with former Canadian Prime Minister Justin Trudeau in Paris following a romantic date for her 41st birthday
"""Our Hope Is..."": After Trudeau Exit, India Recalls ""Licence To Extremists""","Days after Mark Carney replaced Justin Trudeau as Prime Minister of Canada, India, on Friday, recalled ""the downturn in India-Canada relations""."
"Major Reshuffle As Justin Trudeau Faces Party Pressure, Tensions With Trump","Canadian Prime Minister Justin Trudeau on Friday shook up his cabinet, changing one-third of his team as political turmoil threatens his leadership and tensions..."
Katy Perry confirms Justin Trudeau romance while rejecting fan’s marriage proposal,Katy Perry confirmed her relationship with Justin Trudeau during her Prague concert on Thursday after a fan in the crowd asked the singer to marry him with a si...
13 Trudeau-era ministers survive Carney's cabinet overhaul,"When Prime Minister Mark Carney unveiled his new cabinet this week, there were 15 fresh faces among the group. There were also 13 who had served in the previous..."
Trudeau: Canada Ready for US Tariffs,Trudeau noted that he had met with the Premiers and the Cabinet to discuss the matter
"Canadian PM Trudeau steps down, hunt on for new leader",Trudeau said that he had spoken to the Liberal Party President to start looking for a new prime ministerial candidate.
Who will be next Prime Minister after Justin Trudeau resigns?,"Rest of World News: Canadian Prime Minister Justin Trudeau announces his resignation, citing internal party battles as a hindrance to being the best option in t..."
"Trudeau Slaps 25% Tariffs On US, Calls Trump's Trade War ""Dumb Thing To Do""","On Tuesday, speaking from Parliament Hill, Trudeau criticised US President Donald Trump's decision, saying that tariffs are a"
Canadian PM Justin Trudeau to announce resignation as early as Monday: report,"Canadian media reports that Prime Minister Justin Trudeau is expected to resign this week, citing three sources. Trudeau took office in 2015."
Trudeau shares farewell message on last day as prime minister - National,"'I'm proud to have served a country full of people who stand up for what's right,' Prime Minister Justin Trudeau said in a video on his last day in office."
Trudeau to announce Canada's response to Trump trade war,The North American trade war of 2025 has officially begun with Canada hitting back against the U.S. after President Donald Trump imposed punishing 25 per cent t...
Why Trump Joked About Making Canada '51st US State' During Trudeau Meet,"US President-elect Donal Trump, during his last week's meeting with Canadian Prime Minister Justin Trudeau, reportedly joked about making Canada the 51st state ..."
Trudeau attends U.S. trade meeting as MPs call for him to resign,Trump promised to enact 25 per cent tariffs on Canadian and Mexican imports unless both countries meet his demand to beef up security at the American border.
Trudeau to meet Polish PM and sign nuclear energy cooperation agreement,KRAKOW — Prime Minister Justin Trudeau is travelling to Warsaw today to meet with his Polish counterpart Donald Tusk. The two leaders are set to sign the Cana...
"Trudeau has confrontational call with Trump over tariffs, but no deal yet",Trudeau and Trump spoke by phone Wednesday for around 50 minutes. The Wall Street Journal reported the call grew heated and included profanity.
Justin Trudeau Meets Donald Trump In Florida As Tariff Threats Loom,Justin Trudeau had an
This could finally be the end of Justin Trudeau,He's in freefall
U.S. President Biden says 'the world is better off' because of Trudeau,"U.S. President Joe Biden thanked Prime Minister Justin Trudeau on Tuesday, calling him a 'friend,' and adding 'the world is better off because of him.'"
Trump's fresh 51st state nudge as Justin Trudeau faces trouble: 'Many Canadians want...',"US News:  While the 51st state was a dinner table joke supposed to stay at Mar-a-Lago, it did not as it was widely reported and Trump too publicized it. MAGA s"
"Trudeau talks border, trade in surprise dinner with Trump at Mar-a-Lago",Prime Minister Justin Trudeau discussed border security and trade during a surprise dinner with U.S.-president elect Donald Trump at Mar-a-Lago in West Palm Bea...
Trudeau teeters in Canada after deputy’s scathing resignation,"Even before the deputy shocked the country with her letter, Prime Minister Justin Trudeau’s grasp on power already appeared to be slipping."
André Pratte: The Trudeau-Carney era’s catastrophic mismanagement,The Liberals have been gravely irresponsible with public finances
Trump responds to Trudeau resignation by suggesting Canada merge with U.S.,Prime Minister Justin Trudeau's resignation as Liberal leader comes just two weeks before Donald Trump takes office as U.S. president while threatening to impos...
"Canada PM Trudeau to announce intention to step down, CBC News reports",Canadian Prime Minister Justin Trudeau will announce on Monday that he intends to step down as Liberal leader
Canadian Finance Minister resigns as Trudeau government's popularity flounders,"Canadian Finance Minister Chrystia Freeland announced her resignation from Justin Trudeau's Cabinet on Monday, a powerful blow to the Liberal Prime Minister's h..."
"US Says Justin Trudeau Has Been America's ""Stalwart Friend""","The White House said on Monday that Canadian Prime Minister Justin Trudeau, who announced that he will step down in the coming months after nine years in power,..."
Katy Perry and Justin Trudeau Seen Passionately Kissing on a Yacht,"Katy Perry and ﻿Canadian Prime Minister Justin Trudeau were seen kissing on the singer’s yacht,﻿ the Caravelle, off the coast of Santa Barbara, California..."
FIRST READING: The last time Canada had a Trudeau who refused to leave,The elder Trudeau also stayed on until virtually the entire country despised him.
Justin Trudeau romance with Katy Perry is ‘midlife crisis’ after marriage breakup: source,"After Katy Perry and Justin Trudeau were spotted cuddling and kissing on a yacht, sources called the new romance a 'midlife crisis' and beneficial for both of t..."
Trudeau reduced to tears after ‘colourful’ phone call with Trump over tariffs,"Justin Trudeau was reduced to tears at a press conference on Thursday night, after reports of a profanity-laden phone call with Donald Trump."
Michael Higgins: Divisive Justin Trudeau is at it again,"Rather than emphasizing what he and Premier Danielle Smith agree on regarding Trump's tariff threats, the PM plays up their differences"
Is Katy Perry dating Justin Trudeau? Duo spotted during private dinner Outing,
Who Will Replace Justin Trudeau As Prime Minister Of Canada?,Canadian Prime Minister Justin Trudeau announced his resignation after facing an increasing loss of support both within his party and in the country. Now Trud...
Katy Perry Reacts to Fan Proposal After Yacht PDA With Justin Trudeau,Katy Perry reacted to a fan’s onstage proposal in London just two days after photos of her sharing PDA on a yacht with Justin Trudeau surfaced
Trudeau calls meeting with premiers to take ‘Team Canada’ approach to Trump tariffs,OTTAWA — Prime Minister Justin Trudeau says he’ll call a meeting with premiers to take a ‘Team Canada’ response to Donald Trump’s threat of imposing h...
Woke icon Justin Trudeau resigns after party rejects his leadership,"Canadian Prime Minister Justin Trudeau has announced his resignation after over nine years in office, citing internal party strife and poor."
Trudeau calls conversation with Trump 'excellent' after meeting in Florida,"Trump, in his first term as president, called Trudeau ""weak"" and ""dishonest,"" yet Trudeau was the first G7 leader to visit him since Nov. 5."
Life after Justin Trudeau for the Liberal Party of Canada,"Unlike his father, who also left office amid widespread unpopularity but had just repatriated the Constitution and created the Charter of Rights and Freedoms, i..."
How Justin Trudeau Changed Katy Perry’s Mind About Dating Him,Katy Perry wasn’t looking for a relationship when she and Justin Trudeau first went out in July. Here’s how he changed her mind and got her to date him.
Singh says NDP will vote to bring down Trudeau government,NDP Leader Jagmeet Singh says his party will bring forward a motion of non-confidence to bring down the Trudeau government in the next sitting of the House of C...
"Trump’s Threat to Annex Canada: A Real Concern, Says Trudeau",Canadian Prime Minister Justin Trudeau views Donald Trump's threat to annex Canada as a serious issue. Trudeau made these comments
Trudeau says democracy at stake as Ukraine kept away from peace talks,"Prime Minister Justin Trudeau says Ukraine must have a seat at the table in any peace talks, as Washington and Moscow discuss ways to end the war. Trudeau says ..."
Trudeau set to shuffle his cabinet Friday after a tumultuous week: sources,"Prime Minister Justin Trudeau will shuffle his cabinet Friday, multiple sources have told CBC News. He's got big gaps to fill on his front bench after a spate o..."
Justin Trudeau to resign as Canadian PM today amid party pressure? Report claims...,"Trudeau, who has led the Liberal Party since 2013, faces mounting pressure within his party to step aside as polls predict a major defeat to the opposition Cons..."
"ANALYSIS: Justin Trudeau, who thrived as an underdog, loses the fight - National",The long-serving prime minister leaves behind a mixed legacy of political achievement and scandals after announcing his resignation.
"Why Canada PM Justin Trudeau May Resign, This Is What You Need To Know",Canadian PM Justin Trudeau assumed office nine years ago with a halo around him. He certainly does not have such image anymore. Canadian media has reported that...
Justin Trudeau & Katy Perry had a romantic dinner together in Montreal??,"Celebitchy is a daily gossip and entertainment blog, started in 2006, which also focuses on liberal politics, royal coverage and fashion."
"Wait, Are Katy Perry and Justin Trudeau Dating?","After conquering space, Katy Perry is moving on to Canada, where she dined with former Canadian prime minister Justin Trudeau on Monday."
Katy Perry and Justin Trudeau Are Officially Dating,Katy Perry and Justin Trudeau are officially dating after leaving a breadcrumb trail of clues during the summer. Here’s everything we know about their relatio...
Why did Justin Trudeau resign as Canada PM? What we know so far,"Rest of World News: In a historic move, Justin Trudeau announced his resignation as both leader of the Liberal Party and Prime Minister of Canada this Monday."
"Trudeau, Trump discuss Ukraine and shared border","On February 1, Trump signed an executive order to impose tariffs on goods from Canada, China and Mexico"
Trudeau asks Indigenous leaders in Canada for help standing up to Trump,National Indigenous leaders in Canada say the prime minister is asking them to lobby their counterparts in the United States as part of the pushback against pre...
Canada’s Justin Trudeau Expected to Resign as Liberal Party Leader This Week: Report,"Canadian Prime Minister Justin Trudeau is preparing to announce his resignation as Liberal Party Leader as soon as Monday, according to a new report in The Glob..."
Jesse Kline: Trudeau chooses weakness in face of Trump tariffs,Liberals have had months to prepare and have done almost nothing
"Trudeau asked Trump for California, Vermont to curb annexation talks","Justin Trudeau says U.S. president-elect Donald Trump kicked the tires on the potential annexation of Canada during their recent meeting in Florida, but the top..."
Canada's Trudeau vows immediate & strong response to Trump's 'unjustified tariffs',US News: Canadian Prime Minister Justin Trudeau has pledged a strong response to US President Donald Trump's plan to impose tariffs on Canadian imports startin
Trudeau says Trump’s 51st state talk distracts from cost tariffs will bring - National,"In an interview with CNN, Trudeau pushed back again on the idea of Canada becoming part of the U.S., which Trump has continued to push in comments to media."
Donald Trump Heard Mocking Justin Trudeau on Gaza Hot Mic,"A joking exchange between President Donald Trump and Canadian Prime Minister Mark Carney was caught on a hot mic during a summit of world leaders in Egypt,…"
Katy Perry and Justin Trudeau Share a ‘Supersized Attraction’,"Katy Perry and Justin Trudeau’s romance is back on, and a source said that in addition to their ‘supersized attraction,’ the pair ‘loves to talk about s..."
Justin Trudeau Dresses Up as Left Shark Amid Katy Perry Romance,Justin Trudeau dresses as the viral Left Shark with son Hadrien as Katy Perry romance rumors swirl and their relationship remains low key with private meetings
"""Time For You To Step Aside"": Canada MP's Letter To Justin Trudeau",Canadian MP Chandra Arya has added to the uncertainty of the future of Prime Minister Justin Trudeau's leadership in the country as he said that he believes it ...
Trudeau urges U.S. consumers to consider the harm of Trump's tariff threats,Canada's outgoing Prime Minister Justin Trudeau on Sunday suggested that President-elect Donald Trump's remarks about Canada becoming America's “51st state”...
Justin Trudeau is resigning. A look back at the demands for him to go - National,Justin Trudeau's decision to resign comes after months of calls from his MPs and years from opposition leaders to step down from the job he's held for more than...
FIRST READING: How far Trudeau could go in clinging to power,"In an extreme case, he prorogues parliament and walls himself up in the PMO until the federal government goes broke"
"Justin Trudeau, Katy Perry spotted dining together at high-end Montreal restaurant",International pop superstar Katy Perry and former prime minister Justin Trudeau were spotted together Monday night at a restaurant in the city's Plateau neighbo...
Trudeau calls for plan to build a new official prime minister’s residence,"OTTAWA — With one foot out the door, Prime Minister Justin Trudeau is asking one of his ministers to help develop a plan for a new official residence to repla..."
Trudeau sets meetings with U.S. and Mexico at G20 summit,"Trudeau will have a series of key meetings on the sidelines of the G20 summit in Rio de Janeiro on Monday, including a talk with Joe Biden."
Trump and Trudeau trade insults as US tariffs kick in,"US President Donald Trump and Canadian Prime Minister Justin Trudeau have traded insults as new US tariffs on imports from Canada, Mexico and China kick in.  ?..."
Justin Trudeau spotted at Katy Perry’s Montreal concert with his daughter - National,The 'Firework' singer is currently on her Lifetimes Tour and is set to perform in Quebec City on Friday.
"Amid calls of resignation, Canada PM Justin Trudeau reshuffles cabinet","Rest of World News: Facing internal dissent and mounting political pressure, Canadian Prime Minister Justin Trudeau reshuffled his cabinet on Friday. This move ..."
Trudeau launches Canada-U.S. council as Trump's tariff threats loom,Outgoing Canadian Prime Minister Justin Trudeau announced Thursday the formation of a Canada-U.S. relations council to support the federal government as it deal...
Is That Katy Perry Kissing Justin Trudeau on a Yacht?,The singer and the former prime minster of Canada appear to be back on after their situationship allegedly “cooled off’ a few months ago.
Katy Perry and Justin Trudeau confirm relationship with Paris appearance,"Katy Perry and former Canadian Prime Minister Justin Trudeau have made their first public appearance as a couple, being photographed hand-in-hand during a weeke..."
"After days of tumult, what’s next for Trudeau? His options, explained - National",The Liberal government has been thrown in disarray by Chrystia Freeland's sudden resignation from cabinet. Here's what Prime Minister Justin Trudeau's options l...
"Justin Trudeau, Donald Trump meet in Florida amid tariff threats - National",Justin Trudeau flew to Florida Friday to have dinner with Donald Trump at his Mar-a-Lago club after Trump threatened to impose sweeping tariffs on Canadian prod...
Trudeau taps Dominic LeBlanc to serve as finance minister after Chrystia Freeland's shock resignation,"After Chrystia Freeland's shocking resignation as finance minister, Public Safety Minister Dominic LeBlanc was sworn in Monday to replace her as Prime Minister..."
Trudeau backs Scholz’s call to Putin over Ukraine,Justin Trudeau has expressed support for Olaf Scholz’s phone call with Vladimir Putin regarding the Ukraine conflict
Canadian finance minister slaps Trudeau with resignation letter,"Canadian Finance Minister Chrystia Freeland resigned from Justin Trudeau’s cabinet on Monday, delivering a scathing letter"
"Katy Perry & Justin Trudeau Are Instagram Official, but There’s a Catch","Justin Trudeau appeared in Katy Perry's 41st birthday video, making their relationship Instagram official."
"Trudeau to attend second day of G20 summit, return to Ottawa",OTTAWA — Prime Minister Justin Trudeau is attending the final day of the G20 summit in Brazil. He is set to go to a working session on sustainable development...
Justin Trudeau spotted at Katy Perry concert days after dining together in Montreal,"Breaking News, Sports, Manitoba, Canada"
Trudeau set to meet with Canadian premiers amid Trump tariff threat,Ontario Premier Doug Ford's office said on Tuesday that a virtual meeting of the country's premiers would take place with Trudeau on Wednesday afternoon.
Ukrainian president says Trudeau is expected to visit Ukraine on Monday,The Prime Minister’s Office says Justin Trudeau spoke with U.S. President Donald Trump on Saturday about the war in Ukraine and Canada’s efforts to combat f...
Canadian Prime Minister Justin Trudeau Faces Calls To Resign. Here’s What Could Happen Next,Canadian Prime Minister Justin Trudeau faces growing pressure to resign from his own Liberal Party after his top minister abruptly quit and criticized his han...
Trudeau says Canada 'ready' for Trump tariffs as ministers make final push in D.C.,"Prime Minister Justin Trudeau says Canada is ready to deliver a ""purposeful, forceful but reasonable, immediate"" response if U.S. President Donald Trump imposes..."
Trudeau to make announcement at 7:45 a.m. PT amid calls for resignation,The Prime Minister's Office called reporters to Rideau Cottage for 7 a.m. PT and Trudeau is set to speak at 7:45 a.m. PT.
'F*ck Trudeau? Don't Mind If I Do!',"Katy and Justin sitting in a tree, K-I-S-S-I-N-G."
"Opinion | For An India-Canada Reset, Trudeau Really Had To Go",Trudeau's departure was needed for an India-Canada reset as the strategic partnership that was put in place in 2015 now lies in shambles.
Butts says Trudeau less likely to remain leader since Freeland quit - National,Gerald Butts wrote in a Substack newsletter that Finance Minister Chrystia Freeland's surprise resignation from cabinet last week dealt Trudeau a staggering blo...
"DAVID MARCUS: Trudeau exits the stage. Canadian Truckers 1, Prime Minister 0","Back in 2015 when Justin Trudeau ascended to the prime minister role, he was supposed to be the young, sexy, brash leader who could guide the Liberal Party and ..."
"G20 summit: Trudeau set to meet Biden, other world leaders in Rio - National",The meeting will take place a day after The Associated Press reported that Biden has authorized Ukraine to use U.S.-supplied long-range missiles to strike deepe...
"Harper and Trudeau share laughs, and other lighter throne speech moments","Despite the pomp and circumstance surrounding the speech from the throne, the moments leading up to it were all but formal."
How much has Prime Minister Justin Trudeau changed Canada? The reviews are mixed,"As Trudeau prepares to step down, CBC's The House spoke to experts and analysts about the legacy he leaves behind — and whether Trudeau's transformation of Ca..."
"Larry Kudlow: Trudeau ""betrayed"" Trump at G7, ""should have known better""",On
Trump is open to using 'economic force' to acquire Canada; Trudeau responds,"Prime Minister Justin Trudeau said 'there isn’t a snowball’s chance in hell that Canada would become part of the United States,' on the same day U.S. presid..."
Why are there calls for Justin Trudeau to resign? Explaining the Canadian PM's political woes,"A decade ago, Canadian Prime Minister Justin Trudeau was a shining figure in international diplomacy. Now he's facing a no-confidence vote."
Canada must not ‘freak out’ over Trump’s tariff threat – Trudeau,The President-elect has threatened Ottawa with 25% tariffs on imports unless it tightens border security
Katy Perry & Justin Trudeau Seen on Dinner Date in Montreal,"Katy Perry is saying ""bon appétit"" to Justin Trudeau ... as the pair was seen chowing down at a swanky restaurant in Montreal."
Trudeau sign nuclear energy cooperation agreement with Poland,Prime Minister Justin Trudeau is travelling to Warsaw today to meet with his Polish counterpart Donald Tusk.
Katy Perry Subtly Soft Launches Justin Trudeau Relationship,"Katy Perry included her new beau Justin Trudeau in an Instagram post celebrating her 41st birthday, officially soft launching their romance on social media."
Trudeau to meet Polish PM and sign nuclear energy cooperation agreement,"Breaking News, Sports, Manitoba, Canada"
Katy Perry Tells Fan She Is Dating Somebody Else Amid Trudeau Romance,Katy Perry told a Prague crowd she is dating somebody else amid reports she is exploring a romance with Justin Trudeau and fans proposing
"Orlando Bloom Jokingly Reacts to Katy Perry, Justin Trudeau Rumored Romance","Orlando Bloom reacted to a satirical post about him going on date with former German Chancellor Angela Merkel, seemingly referencing the rumored romance between..."
