title,description
Trudeau to appoint new senators before successor is chosen - National,"The prorogation of Parliament doesn't prevent the appointment of new senators, and the Prime Minister's Office says the selection process is underway."
Trump wants Canada’s economy to ‘collapse’ to make annexation ‘easier’: Trudeau,Trudeau warns of Trump's tariffs to destroy Canada's economy for easier annexation by the United States.
What happens next for Canada as Trudeau resigns?,Trudeau said he will step aside as Prime Minister and Liberal leader. What does that mean for the country?
‘No way in hell’ Trump’s getting Canada – Trudeau,Prime Minister Justin Trudeau has said Canada will never become a US state
‘No way in hell’ Trump’s getting Canada – Trudeau,Prime Minister Justin Trudeau has said Canada will never become a US state
How Justin Trudeau lost Canada,"In his nine-plus years as prime minister Justin Trudeau has unwittingly seeded a slow-moving national unity crisis. Now, it will be up to his successor to addre..."
Canadian PM Trudeau likely to resign this week: report,"Canadian Prime Minister Justin Trudeau is likely to announce his resignation this week as he faces mounting dissent within his Liberal Party, newspaper The Glob..."
'It was the right decision': Quebec politicians react to Trudeau resignation,Elected officials in Quebec were quick to react to the major announcement in Ottawa Monday about Prime Minister Justin Trudeau and the path forward for the fede...
Trudeau says Trump's Canada annexation threat 'a real thing',"Prime Minister Justin Trudeau told an economic summit Friday that President Donald Trump is serious about annexing Canada to access its natural resources, as hi..."
Katy Perry and Justin Trudeau Pack on PDA During Yacht Outing,Katy Perry and Justin Trudeau were spotted kissing and cuddling on a yacht near Santa Barbara following her split from Orlando Bloom in June
"Canada's Justin Trudeau faces internal revolt, calls for resignation grow",Rest of World News: Canadian Prime Minister Justin Trudeau faces mounting pressure to resign amid dwindling support within the Liberal Party. Following Deputy P...
Biden says 'the world is better off' because of Trudeau,"U.S. President Joe Biden has issued a glowing review of Prime Minister Justin Trudeau's time in office, describing him as a man who left the world, the continen..."
Katy Perry & Justin Trudeau Don’t Share the Same Feelings — Source,Katy Perry is reportedly far more invested in her rumored romance with Justin Trudeau than the ex-Canadian prime minister is.
"How does Canada define itself? 'We're not Americans,' Trudeau tells CNN",Prime Minister Justin Trudeau said Donald Trump's repeated digs about Canada becoming the 51st state are a distraction.
Will Justin Trudeau become first victim of Trump's tariff war?,US News: Canadian Deputy PM Chrystia Freeland's shocking resignation throws Prime Minister Justin Trudeau's government into turmoil amidst economic woes and US
"Canada's Justin Trudeau responds to Donald Trump's '51st state' jibe, calls him...",Trudeau called the comments a “distraction tactic” and emphasised Canadians' pride in their national identity
Washington views Canada’s PM Trudeau as ‘stalwart friend’ of US — official,"White House Press Secretary Karine Jean-Pierre added that the US would ""stand with"" all people of Canada as they elected a new leader"
Race begins to replace Canadian PM Trudeau,"The race to be Canadian Prime Minister Justin Trudeau's successor kicked off on Tuesday, a day after he resigned amid a looming trade war with the United States..."
Trudeau expected to outline Canada’s response to Trump’s tariffs,Prime Minister Justin Trudeau is expected to take questions later this morning about how Canada will respond in the face of sweeping tariffs imposed by U.S. Pre...
Canada's Justin Trudeau Breaks Down On Camera During Farewell Speech,The glimpses of a teared-up Justin Trudeau marks one of his final moments as the Prime Minister of Canada before his Liberal Party chooses a new successor to ri...
Canada’s Trudeau Announces Intention to Resign as Prime Minister,"If elections were held today, the opposition Conservative Party would almost certainly take office."
Trudeau announces tariff deal with Trump,Canadian Prime Minister Justin Trudeau has confirmed duties suspension for at least 30 days
Katy Perry & Justin Trudeau Take Next Big Step in Relationship — Source,Katy Perry and Justin Trudeau are reportedly planning to spend a romantic time together during the Christmas holiday.
Canada PM Justin Trudeau could resign today…,The sheen has rubbed off the Prince Charming of international politics with predictions that he will resign today. From the Guardian: The Globe and Mail newspap...
"Trudeau, Biden discuss rule of law at Brazil G20 summit","Prime Minister Justin Trudeau spent his first day at the G20 leaders' summit Monday speaking in closed-door meetings about issues like continental trade, fighti..."
Trudeau inviting premiers to Ottawa as Trump inauguration looms,Prime Minister Justin Trudeau is inviting provincial and territorial premiers to Ottawa next Wednesday to discuss Canada-U.S. relations.
Trudeau has prorogued Parliament. Here’s what that means - National,Prime Minister Justin Trudeau said Gov. Gen. Mary Simon has agreed with his request to prorogue Parliament until March 24 as the Liberals hold a contest to repl...
Trudeau trolls Trump after Canada bests USA at hockey,Canadian Prime Minister Justin Trudeau took a jab at President Trump after Canada's victory over the United States in an international hockey tournament.
Trudeau Quits: Canada faces political uncertainty and leadership change,Forty-three-year-old Trudeau’s positive political message and energetic personality had helped the Liberals win a historic majority in Parliament in 2015.
"""Doonesbury"" cartoonist Garry Trudeau",In a first for
Canada’s Justin Trudeau resigns,The resignation of Justin Trudeau comes amid the worst political crisis of his nine-year term as Canada’s prime minister
Trudeau finished,"Canadian PM Justin Trudeau is finished - either this week, or at the election. Any tiny chance of victory has disappeared with the dramatic resignation of not j..."
Canada's Trudeau announces resignation,Canadian Prime Minister Justin Trudeau is stepping down after nearly a decade in office
Justin Trudeau Might Be the Only One Who Still Believes in Justin Trudeau,When stubbornness becomes a political strategy
Trump calls Trudeau ‘a loser’,The US president has claimed that “loser” Justin Trudeau has done a bad job governing Canada
"Sophie Grégoire Trudeau Breaks Silence on Justin Trudeau, Katy Perry Romance","Justin Trudeau’s estranged wife Sophie Grégoire Trudeau spoke about her ex’s life in the public eye following their separation in 2023, including his rumor..."
Trudeau Trump Meeting: Old video of Trudeau mocking Trump viral as Canada PM dines with President-elect,US News: A 2019 video of Justin Trudeau mocking Donald Trump has gone viral as the Canadian PM flew to Florida to meet President-elect Trump following Trump's
Former Canadian PM Trudeau visits Valais mountains,Former Canadian Prime Minister Justin Trudeau explores Zermatt with his son.
Justin Trudeau Is a KatyCat,Former Canadian prime minister Justin Trudeau gleefully sang along to ‘Firework’ at Katy Perry’s ‘Lifetimes’ tour stop in Montreal.
Trudeau blasts Trump’s ‘dumb’ tariffs,Canadian Prime Minister Justin Trudeau has condemned US President Donald Trump for imposing tariffs on Canadian imports
Trudeau Trump Meeting: Trump says meeting with Trudeau was very productive: 'I made it very clear that...',US News: Donald Trump described his meeting with Justin Trudeau as very productive while Trudeau said he had an excellent conversation with Trump. Trudeau flew
Canada's Prime Minister Justin Trudeau resigns,"In power since 2015, Trudeau said he would resign after a new leader of his Liberal Party is chosen."
Canadian PM Justin Trudeau Announces his Resignation,"Canadian Prime Minister Justin Trudeau has announced his resignation, telling the nation that “internal battles” mean he “cannot be the best option” in ..."
Trump takes jab at 'governor' Trudeau,The president-elect referred to the 'great state' of Canada in a social media post.
"What? Justin Trudeau reunites with ex-wife Sophie Grégoire Trudeau and kids, after pictures with Katy Perry go viral-- Here's why","Justin Trudeau is reportedly dating Katy Perry, with intimate yacht photos fueling romance rumors. Amidst this, he reunited with ex-wife Sophie Grégoi"
Justin Trudeau and Katy Perry Dating Rumor,Justin Trudeau and Katy Perry Dating Rumor refers to a rumored relationship between former Canadian Prime Minister Justin Trudeau and American pop singer K
Watch: Profile | Canadian Prime Minister Justin Trudeau,"Justin Trudeau resigned as Canada’s Prime Minister and Liberal Party leader on January 6th, 2025. His announcement came amid rising discontent over his leader..."
Are Katy Perry and Justin Trudeau dating?,Photos of pop star and ex Canadian PM getting cosy on a yacht spark social media frenzy
Trudeau may quit as Canadian PM – media,Justin Trudeau is reportedly expected to step down as Liberal Party leader due to policy disputes
Justin Trudeau: Justin Trudeau trolled for 2011's 'porn site QR code problem' post. Here's what happened back then,US News: Canadian Prime Minister Justin Trudeau's 2011 social media post about a QR code mishap resurfaced amidst criticism of his attendance at a Taylor Swift
Trudeau removes himself from the equation,"In announcing his intention to step away now, the prime minister creates two challenges — one for himself and one for his successor."
Katy Perry Reportedly Finds Justin Trudeau ‘Attractive’,"A new report concerning dating rumors surrounding Justin Trudeau and Katy Perry has emerged. It alleges the pair has an ""easy connection."""
Diplo Trolls Internet With Suspicious Justin Trudeau Selfie,"Diplo shares a selfie with Justin Trudeau and Katy Perry, as a playful jab at his former flame and her new partner."
Is Justin Trudeau about to resign?,"Over the last two weeks, Prime Minister Justin Trudeau has faced new and growing calls to resign. Could he finally step down this week?"
Canadian Prime Minister Justin Trudeau wins second term,Canadian Prime Minister Justin Trudeau won a second term Monday. Trudeau faced a close race against conservative Andrew Scheer following a series of scandals la...
Canada's PM Justin Trudeau to step down,The embattled prime minister will leave office once a new leader is chosen.
"Katy Perry, Justin Trudeau Seen Kissing on Yacht",Pop star Katy Perry and former Canadian Prime Minister Justin Trudeau were seen engaging in some hot and heavy PDA while on the
Trudeau exit shakes up Canadian politics,"OTTAWA - Justin Trudeau is resigning after more than nine years as Canada’s prime minister, bowing to dreadful polls and a rebellion within his governing Libe..."
Trump Trolls Justin Trudeau After Canadian Finance Minister Resigns,President-elect Donald Trump trolled Canadian Prime Minister Justin Trudeau after Finance Minister Chrystia Freeland resigned.
"Assessing the Trudeau record, real and imagined",Declining support for the Liberal Party should not be confused with declining support for progressive policies that create communities where all can thrive.
Trudeau reports ‘excellent conversation’ with Trump,Canadian Prime Minister Justin Trudeau says he has had an “excellent conversation” with Donald Trump at his Mar-a-Lago club following the US president-elect...
Trudeau faces political crisis as Chrystia Freeland resigns,"In a letter to Trudeau, Chrystia Freeland said, “For the last number of weeks, you and I have found ourselves at odds over the best path forward for Canada.?..."
"Trudeau prorogues Parliament, resigns as Liberal Party leader",Conservative Leader Pierre Poilievre has repeatedly stated that Trudeau lost government control and repeated calls for an election.
"Justin Trudeau: The Good, the Bad, and the Ugly","By quitting, Trudeau might just save the Liberals from an epic electoral disaster."
Canada’s PM Justin Trudeau Announces Resignation,The Canadian leader's popularity was seriously damaged by the recent resignation of former Deputy Prime Minister Chrystia Freeland of Toronto.
Justin Trudeau & Katy Perry: Romance rumours heat up,"Pictures of former Canada PM Justin Trudeau and pop star Katy Perry kissing on a yacht go viral, fueling romance rumours. Read more at straitstimes.com."
Katy Perry Soft-Launched Justin Trudeau on Instagram,"About six months after she hard-launched into space, Katy Perry soft-launched her relationship with Justin Trudeau in a blink-and-you’ll-miss-it cameo in a vi..."
Justin Trudeau 'crazy' about 'perfect' Katy Perry,"Justin Trudeau 'crazy' about 'perfect' Katy Perry, sources tell Page Six. The pair were recently seen on their first public date in Paris."
"Katy Perry, Justin Trudeau Spotted Kissing on Yacht",The popstar and former Canadian Prime Minister appear to have confirmed dating rumours
Trudeau faces frustrated MPs after Chrystia Freeland's shock resignation,Prime Minister Justin Trudeau faced frustrated MPs at a hastily arranged caucus meeting late Monday following Chrystia Freeland's shocking decision to resign f...
Trudeau gets smiles with stern speech to President 'Donald',"Prime Minister Justin Trudeau struck an informal tone on Tuesday, addressing the U.S. president several times as just “Donald” in a speech that was broadcas..."
Trudeau goneburger,"Canadian PM Justin Trudeau is resigning this week, in advance of a no confidence vote in his Government he was going to lose. The majority of his MPs had called..."
Katy Perry Spotted With Justin Trudeau,"Katy Perry was seen dining and bar-hopping in Montreal with Justin Trudeau, sparking dating rumors just weeks after her split from Orlando Bloom. Here’s every..."
Trump Trudeau Dinner: Did Trump make Trudeau spend the night at a hotel? Here's the truth behind viral X post,US News: An X post that claimed that Donald Trump did not ask Justin Trudeau to stay at Mar-a-Lago at night after their dinner went viral with social media use
Why's Trudeau Sticking Out His Tongue?,Canada's outgoing Prime Minister Justin Trudeau carries his chair from the House of Commons on Parliament Hill in Ottawa.
Justin Trudeau Attends Katy Perry Concert in Montreal,Justin Trudeau attended Katy Perry’s Montreal concert … 2 days after being spotted having dinner and cozy drinks together.
When will Canada hear from Justin Trudeau?,Trudeau leaves Canada in suspense as anxious Liberals urge him to go.
"Maybe Canadians were the problem, not Trudeau",Canada has struggled to address key challenges for nearly a generation. This failure was bipartisan and it stems from stems from Canadians simply not wanting to...
Canadian 'Governor' Trudeau Mocked After Announcing Plans to Resign,Americans soundly mocked Canadian Prime Minister Justin Trudeau on Monday after he announced plans to resign his post.
Trudeau spotted at Katy Perry concert days Montreal date,"Justin Trudeau was spotted in the crowd at Katy Perry’s concert in Montreal, days after duo dined together in the city."
Justin Trudeau & Katy Perry ‘Value Connections’ — Report,Sources close to Katy Perry have claimed that the singer is currently 'in a great place' with respect to her romance with Justin Trudeau.
Sophie Grégoire Trudeau: All about the estranged wife of former Canadian PM caught in the middle of Justin Trudeau-Katy Perry romance,"Canadian Prime Minister Justin Trudeau's rumored romance with Katy Perry is gaining traction, with the pair recently vacationing together. This comes"
"Katy Perry & Justin Trudeau Click Really Well, Says ‘Source’","Katy Perry and Justin Trudeau, who recently enjoyed a dinner night in Montreal, reportedly like ""chatting"" with one another."
Katy Perry Jokes About Englishmen Amid Justin Trudeau Romance,"Katy Perry seemingly teased her romance with Justin Trudeau during her London concert, joking about her history with Englishmen and moving on"
Trudeau on the brink after chaotic day in Ottawa,Canada's politics were thrown into chaos after the sudden exit of the country's finance minister.
Treasury Secretary Scott Bessent: Justin Trudeau Is a ‘Numbskull’,"Secretary of the Treasury Scott Bessent called Canadian Prime Minister Justin Trudeau a ""numbskull"" on Thursday, in response to Trudeau declaring Canada will c..."
Canada will never join US – Trudeau,US President Donald Trump has repeatedly suggested incorporating Canada as the 51st state
Quebec Liberal caucus wants Trudeau to resign: sources,"Quebec MPs are adding to the pressure on Prime Minister Justin Trudeau to step aside as leader. The province's caucus chair, Stéphane Lauzon, consulted with MP..."
Trudeau slams Trump's tariffs as stocks plunge,Canadian Prime Minister Justin Trudeau is calling out President Trump's tariffs levied. This comes as the stock markets show signs of panic among investors over...
Where does Justin Trudeau go without Chrystia Freeland?,"No minister is ever truly irreplaceable. But aside from Trudeau himself, no minister has been more central to this Liberal government than Freeland. Her explos..."
Why Canada Fell Out of Love with Justin Trudeau,He promised sunny ways but left behind a divided country
A timeline of Justin Trudeau and Katy Perry’s relationship,Former prime minister Justin Trudeau and pop star Katy Perry have been linked since this summer when they were spotted out together in Montreal. With a recent o...
Justin Trudeau Attends Katy Perry 'Lifetimes' Concert in Montreal,Justin Trudeau attended Katy Perry's 'Lifetimes Tour' in Montreal days after the two were spotted walking her dog and dining together
Ten (Other) Times Justin Trudeau Could Have Stepped Down,There have been a lot of scandals
Katy Perry & Justin Trudeau Pack on PDA in the Pacific,Katy Perry and a topless Justin Trudeau were spotted getting hot and heavy after months of rumored romance.
Trudeau resigns as Liberal Party leader after growing pressure,Canadian Prime Minister Justin Trudeau announced his resignation on Jan. 6 in the face of rising discontent over his leadership and after the abrupt depart...
Trolls Have a Field Day over Trudeau-Perry Kiss,Netizens question both private integrity and public accountability of ex Canadian PM
What will Canada's second Trudeau era leave behind?,It is impossible in the present to know what history will remember. But Justin Trudeau’s time as a maker of history is now within sight. It is not too early t...
"Trudeau delivers Christmas message, thanks essential workers","Prime Minister Justin Trudeau, in a pre-recorded message, offered Christmas wishes and thanked all essential workers who were on the job so others could celebra..."
Trudeau: Canada ‘will respond’ if Trump imposes tariffs,"Canadian Prime Minister Justin Trudeau has warned of retaliatory measures if US President-elect Donald Trump imposes new tariffs, citing the success o"
How Justin Trudeau won and lost the public's adoration,"In his early days as prime minister, Justin Trudeau was ""cool."" In the year that followed his majority sweep into power, he appeared in the pages of Vogue, on t..."
Trudeau to appear at Liberal fundraiser tonight,"Chrystia Freeland, Canada's finance minister, said in an explosive letter published Monday morning that she will quit cabinet. Follow along for live updates."
"U.S.-Canada alliance stronger because of Trudeau, Biden says - National","The outgoing U.S. president listed a range of issues that he and Trudeau worked on together, 'from the COVID-19 pandemic, to climate change, to the scourge of..."
Canadian Prime Minister Justin Trudeau announces his resignation,"Canadian Prime Minister Justin Trudeau has announced his resignation, telling the media that “internal battles” mean he “cannot be the best option” in t..."
Trudeau slams Trump’s ‘dumb’ tariffs as economic war on Canada,"Trudeau blasts Trump’s tariffs as an attack on Canada’s economy, warning of severe consequences for both nations."
Trudeau announces Canada-U.S. Economic Summit for Friday,"With the threat of punishing tariffs on pause but still hovering over the Canadian economy, Prime Minister Justin Trudeau announced the government will host a C..."
Trudeau calls for calm in face of Trump's tariff threat,"Canadians need to remain calm in the face of U.S. president-elect Donald Trump’s threat to impose 25 per cent tariffs on all imports from Canada, Prime Minist..."
Tariffs on Canada also postponed after Trump-Trudeau talks,"After agreeing with Mexico's Claudia Sheinbaum on a one-month pause for the imposition of 25% tariffs, US President Donald Trump reached an understanding Monday..."
Why Donald Trump has a rocky relationship with Justin Trudeau?,"The relationship remains strained, with significant economic stakes for Canada. If tensions escalate further, the impact on Canada’s economy could be serious"
Photo shows Justin Trudeau kissing Katy Perry on a yacht,"The former prime minister of Canada was seen kissing the Grammy-nominated pop star on her yacht off the coast of Santa Barbara, Calif."
Justin Trudeau Subtly References Katy Perry With Fintastic Halloween Costume,Justin Trudeau paid subtle homage to Katy Perry amid the pair’s growing romance with his Halloween costume—an inflatable shark.
Matthew Lau: Canada's Trudeau-induced economic coma,"No matter what metric you look at — GDP, business investment, jobs, taxes, crime or identity politics — the figures are grim"
Why is Justin Trudeau resigning? Explaining the Canadian PM's political woes,"A decade ago, Canadian Prime Minister Justin Trudeau was a shining figure in international diplomacy. Now he's resigning"
Justin Trudeau resigns as Liberal leader: Follow live updates,Prime Minister Justin Trudeau has stepped down as Liberal leader. Follow along for live updates from CTVNews.ca.
Justin Trudeau Thirsts Over Katy Perry At Her Concert,"The internet is in a frenzy after seeing video footage of Justin Trudeau oogling Katy Perry at her ""Lifetimes Tour"" stop in Montreal July 30."
Trudeau to step down as Canada's PM,
"Katy Perry, Justin Trudeau seen holding hands leaving Paris club",The pair's public appearance on the pop singer's 41st birthday has added fuel to growing speculation the two are in a relationship.
Explainer: Why Canada's Justin Trudeau Is Under Pressure To Quit,Canadian Liberal Prime Minister Justin Trudeau is under increasing pressure to quit after Finance Minister Chrystia Freeland resigned over a policy clash on Mon...
What We Know About The Katy Perry-Justin Trudeau Dating Rumors,Rumors the pop star and ex-Canadian prime minister are dating heated up in recent days after pictures surfaced of the pair kissing and Perry dropped possible hi...
Canadian Prime Minister Justin Trudeau announces plan to resign,"Justin Trudeau will end his nine years in power, following increasing pressure from his own party to step down."
Katy Perry ‘Likes’ Post Spoofing Her Romance With Justin Trudeau,Katy Perry dropped a 'like' on a parody post from 'The Onion' about her romance with former Canadian Prime Minister Justin Trudeau
Justin Trudeau Attends Katy Perry’s Lifetimes Tour Amid Dating Rumors,"Justin Trudeau attended Katy Perry’s ﻿Lifetimes Tour in Montreal, Canada on July 30. Trudeau also brought his daughter, ﻿Ella-Grace, to the concert."
Trudeau announces stepping down as Canada’s prime minister,He added that he is proud to have served Canada and its people
Trudeau plans on stacking Senate before retiring: source,"Prime Minister Justin Trudeau is planning a final wave of appointments to fill the 10 vacancies in the Senate before he retires in March, Radio-Canada has learn..."
Justin Trudeau says he'll resign as prime minister of Canada,"The development comes a month after Canada's deputy prime minister, Chrystia Freeland, resigned suddenly from Trudeau's cabinet."
Justin Trudeau announces he will resign as Canada's Prime Minister,Canadian Prime Minister Justin Trudeau has announced he will step down as leader of the ruling Liberals after nine years in office but will stay on in his post ...
"Justin Trudeau Exits Parliament Race, Ending His Political Career for Now",Radical leftist Prime Minister of Canada Justin Trudeau confirmed on Wednesday that he would not be running for a seat in Parliament.
"Major reshuffle as Trudeau faces party pressure, Trump taunts","Canadian Prime Minister Justin Trudeau on Friday shook up his cabinet, changing one-third of his team as political turmoil threatens his leadership and tensions..."
Trudeau announces his resignation as Prime Minister of Canada,Justin Trudeau announced Monday his resignation as Prime Minister of Canada after nine years in office. His stepping down would become effective once the Libera...
Trudeau says Trump's Canada annexation threat 'a real thing',"Prime Minister Justin Trudeau told an economic summit Friday that President Donald Trump is serious about annexing Canada to access its natural resources, as hi..."
Katy Perry and Justin Trudeau Pack on PDA During Yacht Outing,Katy Perry and Justin Trudeau were spotted kissing and cuddling on a yacht near Santa Barbara following her split from Orlando Bloom in June
"Canada's Justin Trudeau faces internal revolt, calls for resignation grow",Rest of World News: Canadian Prime Minister Justin Trudeau faces mounting pressure to resign amid dwindling support within the Liberal Party. Following Deputy P...
