title,description
Katy Perry and shirtless Justin Trudeau get hot and heavy on singer’s yacht,Katy Perry and Justin Trudeau packed on the PDA in steamy photos from her yacht.
Justin Trudeau and Katy Perry’s Teen-Age Dream,"The pair, spotted together kissing on a yacht, seemed to represent a romance for an era of celebrity politics, when a former President has Netflix deals and the..."
Canada’s Trudeau is to reshuffle his Cabinet as resignation calls mount and discontent rises,TORONTO (AP) — Canadian Prime Minister Justin Trudeau 's cling to power became more tenuous Friday after the opposition party that backed his government for y...
'To Governor Justin Trudeau of Canada': Trump's Christmas message,
Trudeau says he 'had a good call' with Trump about tariffs,"Canadian Prime Minister Justin Trudeau said he ""had a good call” with President-elect Donald Trump following his new announcement of a 25% tariff on items fro..."
"Does Trudeau have the confidence of his cabinet? ‘Yes,’ says LeBlanc - National",Finance Minister Dominic LeBlanc was also asked if he would consider an opportunity to lead the country if he were given the chance.
From $2 resignation burgers to relief: British Columbians react to Trudeau resignation,Reaction has been pouring in following news that Justin Trudeau is stepping down as prime minister and the Liberal leader. Trudeau made the announcement on Mond...
Katy Perry's viral response to fan proposal fuels Justin Trudeau romance talk,Katy Perry's recent remarks at a London concert and viral photos with Justin Trudeau have stirred speculation about her relationship status. The singer gave a c...
Justin Trudeau Steps Down As Canadian Prime Minister After 10 Years In Power (VIDEO),Justin Trudeau made the announcement while addressing a press conference today. There are reports that he will remain in power until a replacement party leader ...
Raymond J. de Souza: Trudeau makes everyone's skin crawl,No more hugs for the prime minister
Kelly McParland: Singh pays the price for protecting Trudeau,NDP is cratering in the polls
Michael Higgins: Liberal caucus submits to Carney as it did to Trudeau,MPs too afraid to adopt Reform Act rules
Justin Trudeau & Katy Perry canoodled on a yacht off the Santa Barbara coast,"Celebitchy is a daily gossip and entertainment blog, started in 2006, which also focuses on liberal politics, royal coverage and fashion."
"Justin Trudeau dresses as Katy Perry’s ‘Left Shark’ for Halloween, sparking romance buzz","Canadian Prime Minister Justin Trudeau sparked romance rumors with pop star Katy Perry by dressing as her iconic \""Left Shark\"" for Halloween. This play"
Katy Perry Breaks Her Silence On Justin Trudeau Romance Following His Ex-Wife’s Cryptic Message,Sources said Justin Trudeau didn’t stop “pursuing” Katy Perry even though she wasn’t looking to date at the time. She was “navigating too many things....
Katy Perry and Justin Trudeau Spark Dating Rumors With Montreal Dinner—Here’s What Really Happened,The chef who served Katy Perry and Justin Trudeau detailed how they were as guests—and whether they showed any PDA amid dating rumors.
What the future might hold for PM Justin Trudeau and the Liberals,"The Liberal government was thrown into disarray this week when Chrystia Freeland stepped down from cabinet as finance minister, reviving calls for Prime Ministe..."
'One Regret': Justin Trudeau Talks About His Political Journey During His Resignation Speech - VIDEO,Justin Trudeau on Monday resigned as the Prime Minister of Canada and also as leader of the Liberal Party after serving for almost nine years. During a press co...
Watch: Trudeau gets emotional at one of his final press conferences,The Canadian prime minister welled up during one of his final press conferences as leader of the country.
Trudeau says abandoning electoral reform is his biggest regret. Here's how it happened,"After announcing he would be resigning as prime minister, Justin Trudeau said one of his biggest regrets was not bringing in a ranked ballot system for federal ..."
Justin Trudeau,"Justin Trudeau and Katy Perry have cooled off after their dinner date due to Justin not being ""thrilled"" about the fallout."
'So proud': Trudeau posts farewell video to Canadians on his last day in office,"Trudeau said his only wish is that, no matter what the world throws at Canadians, they will ""always be the same."""
Yukon MP joins chorus of Liberals calling on Trudeau to resign,Yukon MP Brendan Hanley is joining more than a dozen of his Liberal caucus colleagues who say Prime Minister Justin Trudeau should step down.
"""Neighbour Helping Neighbor"": Trudeau Sends Aid To Fight Los Angeles Fire",Canadian Prime Minister Justin Trudeau has sent firefighting resources to California as the state grapples with devastating wildfires. This comes despite the on...
"Katy Perry & Justin Trudeau Pose in a Toy Store, but It’s Fake","Katy Perry and Justin Trudeau pose in a toy store together, but there's a catch as the latter was photoshopped into the photo."
Katy Perry Believes She Met Justin Trudeau in Past Life — Source,"Katy Perry’s new romance with Justin Trudeau has been making headlines, and Perry believes there's a spiritual connection between them."
"BREAKING: Trudeau meeting with Trump, cabinet nominees at Mar-a-Lago",Trump has threatened to impose a 25-per-cent tariff on goods entering from Canada and Mexico unless his concerns about border security are fixed.
Katy Perry and Justin Trudeau finally confirm their relationship as they hold hands in Paris,Katy Perry and Justin Trudeau finally confirmed their relationship as they held hands on a date night in Paris.
Justin Trudeau won’t run for re-election as MP in next federal election,"Justin Trudeau has held the seat of Papineau since 2008 and was named leader of the Liberal Party in 2013, before becoming prime minister in 2015."
BREAKING: Canadian PM Justin Trudeau Resigns Ahead Of General Elections As Discontent Grows,Justin Trudeau will serve as interim PM until a new leader of the Liberal Party is chosen.
Canada: Justin Trudeau Is In A Mess Of His Own Making,"In a faux pas and an ill-timed decision, Canadian Prime Minister Justin Trudeaus move to shuffle Chrystia Freeland out of her Finance Minister role has resulted..."
Trudeau says Trump talk of annexing Canada is a distraction tactic,Canadian Prime Minister Justin Trudeau responds to U.S. President-elect Donald Trump's annexation talk as a distraction from tariffs.
"PM 'low-key,' 'respectful': B.C. ski resort addresses 'misinformation' over Trudeau vacation","The B.C. ski resort where Prime Minister Justin Trudeau holidayed with his family after Christmas says it was ""disappointing"" to see what it describes as misinf..."
"Canada-U.S. summit to tackle interprovincial trade, exports: Trudeau - National","The Prime Minister's Office says the event will assemble Canadian trade and business leaders, along with organized labour, to discuss strategies to grow the eco..."
Katy Perry shares first post since PDA with Justin Trudeau goes viral,"Katy Perry shares her first post on social media since viral photos with Justin Trudeau, sparking rumors of a new romance. Read more about Katy's latest update ..."
Chrystia Freeland quits cabinet and slags Trudeau for 'costly political gimmicks',"In a resignation letter posted to social media, she said Prime Minister Justin Trudeau offered her another role in cabinet on Friday, but that the only ""honest ..."
"Tariffs: Trudeau must ‘reassure’ Donald Trump with a plan, says Legault",
Justin Trudeau says he will not run for re-election in his Montreal riding,"Trudeau, who has said he will step down as Liberal leader when a new leader is chosen, was first elected in his Montreal riding in 2008"
Trump renews his offer of making Canada 51st state of U.S. after Trudeau resigns,"U.S. President-elect Donald Trump renews offer to make Canada the 51st state, sparking controversy and uncertainty in Canada."
Can Trudeau survive Freeland's resignation?,"A scathing resignation letter has triggered an unprecedented leadership crisis for Prime Minister Justin Trudeau. What triggered it, and can he hang on as leade..."
Justin Trudeau resigns. What’s next?,Prime Minister Justin Trudeau has announced he will resign and has prorogued Parliament until March 24. He will stay on as leader and Prime Minister until the L...
President Sheinbaum: Prime Minister Trudeau supports keeping USMCA intact,President Sheinbaum said Wednesday that Justin Trudeau assured her at the G20 summit that he doesn't agree with calls to end the USMCA.
U.S. President Donald Trump is dead serious about a takeover of Canada: Trudeau,"The prime minister said the Trump administration knows what critical minerals Canada has and ""that may be even why they keep talking about absorbing us and maki..."
Trudeau jokes that Liberal party is like a family that ‘fights around the holidays’,"With his political world seemingly crumbling around him, Justin Trudeau proved that one thing is still intact — his sense of humour. In the midst of high-prof..."
"Poilievre blasts ‘despicable’ RCMP leadership, accuses Mounties of covering up for Trudeau","Conservative Leader Pierre Poilievre took aim at the RCMP’s independence in a recent interview, calling the national police force’s ""despicable"" leadership ..."
Justin Trudeau dating Katy Perry: Why we love Mills & Boons yacht romances,"Rest of World News: Explore the surreal love story of Justin Trudeau and Katy Perry on a yacht, capturing the fusion of politics and pop culture. Discover the i..."
LeBlanc says he ‘respects the views’ of NB MPs calling for Trudeau resignation,Finance Minister Dominic LeBlanc says Prime Minister Justin Trudeau listened carefully when some Liberal MPs directly expressed to him that he should resign and...
Trump Reveals He Had 'Productive Meeting' with Trudeau at Mar-a-Lago,"President-elect Donald Trump revealed that he had a ""very productive meeting"" with Canadian Prime Minister Justin Trudeau at Mar-a-Lago."
"Trump pauses tariffs on Canada for at least 30 days, Trudeau says",Trump agreed to delay tariffs on Canada and Mexico after their leaders agreed to measures to stop the flow of the opioid fentanyl into the United States.
Trudeau staunchly defends Zelenskyy as London summit on European security wraps up,Prime Minister Justin Trudeau clearly signalled his view today that Russian President Vladimir Putin cannot be trusted to keep his word on any agreement to end ...
'Canada is not a given' says Trudeau in farewell speech touching on Trump threats,"Prime Minister Justin Trudeau said that freedom, democracy and Canada ""are not a given"" in his farewell speech to Liberals just before former Bank of Canada gov..."
Trudeau government made dozens of appointments after announcing he'd resign,Prime Minister Justin Trudeau's government has stacked agencies and Crown corporations with dozens of
DC Edit | Trudeau quits under a cloud; but crisis with India not over,"Justin Trudeau faces political downfall as economic woes, immigration backlash, and India tensions erode his support"
"Freeland's letter didn't mention gender, but Trudeau faces 'phony feminism' attacks anyway",Prime Minister Justin Trudeau's working relationships with women have been part of the conversation around his politics for more than a decade. After Chrystia F...
‘Nothing is off the table’: Trudeau on US tariff threats,Rest of World News: Canada will consider every kind of countermeasure if US President-elect Trump goes ahead with a threat to impose a 25% tariff on Canadian im...
Trudeau blasts Trump's 'very dumb' trade war,"Retaliatory measures have been announced by America's largest trading partners following Trump's tariffs on Canada, Mexico and China"
Trudeau finally addresses Freeland's shocking resignation. Here's what Canada's PM said,Tuesday’s speech was the first time Trudeau has said anything publicly about Chrystia Freeland's shocking resignation.
"Dead party walking: Freeland quits, Trudeau clings to power","Chrystia Freeland has resigned as finance minister amid bitter feud with Trudeau, setting the stage for an intra-party war as Trump tariffs loom on the horizon."
Trudeau announces 25 percent tariffs in response to Trump order,OTTAWA: Canadian Prime Minister Justin Trudeau said on Saturday Canada would impose 25 percent tariffs on C$155 billion ($106.5 billion) of U.S. goods in respon...
Trudeau travelling to Lisbon to attend the Aga Khan’s funeral,Prime Minister Justin Trudeau is flying to Lisbon on Friday to attend the Aga Khan's funeral.
Here's what Trudeau is doing today amid calls for resignation,"In Ottawa, Trudeau continues to face pressure to step down as Liberal leader after Chrystia Freeland's decision to quit last month."
Trudeau announces tariffs on U.S. in retaliation for Trump's tariffs,"Canada will retaliate against President Donald Trump's new tariffs by imposing 25% tariffs on U.S. goods from drinks to appliances, Prime Minister Justin Trudea..."
Canada's Trudeau survives third no-confidence vote,"Canadian Prime Minister Justin Trudeau's government on Monday survived a third vote of no confidence in as many months, brought by his main Tory rival. The mino..."
"Canada PM Trudeau is likely to announce resignation, source says","An increasing number of Liberal parliamentarians, alarmed by a series of gloomy polls, have publicly urged Trudeau to quit."
Trump Mocks Trudeau After Canadian Leader’s Ominous Warning,Canada’s Justin Trudeau had a serious message for Donald Trump on his tariff plan.
"Faced with turmoil, a defiant Trudeau hangs on - for now","As the longest serving G7 leader, the Canadian prime minister has weathered many storms. But this time might be different."
"Justin Trudeau Feels ‘Ambushed’ by Katy Perry Dating Rumors, Says Source","Justin Trudeau and Katy Perry’s dating rumors have been taking the internet by storm, especially after the pair dined together in Montreal."
"Katy Perry & Justin Trudeau Don’t Mind the Dating Rumors, Says Source","Dating rumors surrounding Katy Perry and Justin Trudeau have surged recently, but sources claim that the two are not dating yet."
Trudeau to attend cabinet committee meeting on Trump tariff threat - National,The committee meets as Donald Trump's Jan. 20 inauguration quickly approaches. Trump promised to enact 25 per cent tariffs on Canadian and Mexican imports
Canadian PM Trudeau likely to resign this week: report,"Announcement to come before national Liberal Party caucus on Wednesday, according to sources."
Trudeau meets with Biden and other leaders at G20,The meeting will take place a day after The Associated Press reported that Biden has authorized Ukraine to use U.S.-supplied long-range missiles to strike deepe...
Letters: A just ending for Justin Trudeau,"Readers comment on the PM's resignation, Trump's threats to annex Canada, the GG's prorogation of Parliament, and more"
Justin Trudeau Net Worth 2025: How Much Money Does He Make?,"Justin Trudeau’s 2025 net worth reflects his political career, inheritance, and investments after stepping down as Prime Minister."
Trudeau in trouble as ally vows to 'bring him down',"The future of Canadian Prime Minister Justin Trudeau's leadership appears increasingly uncertain after New Democratic Party (NDP) leader Jagmeet Singh, a key al..."
Michael Higgins: Trudeau dances as Montreal burns,"It took Trudeau until noon Saturday to address the Montreal riot, and his statement didn't even hint that the Liberals might do something."
Trump trolls Trudeau again as Canadian PM considers resignation,"WASHINGTON: US President-elect Donald Trump has once again referred to Canadian Prime Minister Justin Trudeau as ""governor"" following the unexpected resignation..."
Terry Newman: Trudeau puts Canada last,"Canada is facing an unprecedented economic crisis, and the Liberals can't be bothered to show up to work"
"Not Justin Trudeau? Prove It, Mark Carney — On Climate","Canadians have been fed a steady diet of climate noise — photo-ops, grand announcements, and lofty targets — none of which have translated into serious emis..."
Tom Mulcair: Is Justin Trudeau just playing out the clock?,"Former NDP leader Tom Mulcair says Canada is facing critical issues that need an active, engaged federal government right now; but Prime Minister Trudeau seems ..."
Katy Perry Dines On Lobster And Cocktails With… Justin Trudeau,Katy Perry shocked fans and political observers alike after she was spotted dining with former Canadian Prime Minister Justin Trudeau in Montreal.
N.S. Liberal MP praises Trudeau for plans to step down,Prime Minister Justin Trudeau says he'll go as soon as the party can choose a successor. Sean Fraser says he's glad Trudeau is leaving of his own volition. Watc...
When Justin Trudeau Turned Into An Action Hero For Marvel Comics,"In 2016, Justin Trudeau was featured as an action hero in Marvel Comics’ ‘Civil War II: Choosing Sides’."
Terry Newman: 'Governor Trudeau' deserves Trump's trolling,Trudeau poisoned the well with Trump long ago
Katy Perry and Justin Trudeau pictured holding hands at Paris event,"The pop singer and former Canadian prime minister were pictured over the weekend, fueling relationship speculation."
NP View: Trudeau only ever cared about himself,"For nine years, he has privileged his own interests above all else"
Trudeau and Perry go public with first appearance as couple,The public outing marks a new chapter in a relationship that has been the subject of speculation for months.
Make Canada a state of US: Trump mocks Trudeau,"United States President-elect Donald Trump took a jab at Canadian Prime Minister Justin Trudeau on the social media platform Truth Social, describing him as the..."
What happens now that Trudeau resigns as Canada's prime minister?,"Canadian Prime Minister Justin Trudeau on Monday said he would step down in the coming months after nine years in power, bowing to pressure from lawmakers alarm..."
Trudeau attending U.S. relations cabinet committee meeting amid calls for resignation,Prime Minister Justin Trudeau is taking part in a virtual meeting of the Canada-U.S. relations cabinet committee.
Katy Perry and Justin Trudeau Are Dating?,Katy Perry and Justin Trudeau are rumored to be dating after they were spotted having dinner together in Montreal.
"Trudeau, Carney push back over Trump's ongoing 51st state comments","Two senior members of the federal cabinet were in Florida Friday pushing Canada's new border plan with Donald Trump's transition team, a day after Trudeau himse..."
Justin Trudeau says Trump's ambition to annex Canada is 'real',Trump on Monday agreed to a 30-day pause on threats to impose 25% tariffs on imports from Mexico and Canada.
"Trudeau resigns, Trump renews offer to make Canada 51st US state","US President-elect Donald Trump has renewed his offer to make Canada the 51st state of the United States, hours after Canadian Prime Minister Justin Trudeau res..."
Trudeau says Canada will push back on ‘unacceptable’ U.S. tariffs - National,Prime Minister Justin Trudeau says Ottawa will work to convince U.S. President Donald Trump that his steel and aluminum tariffs will hurt both countries.
"Katy Perry, Justin Trudeau seen kissing on Yacht, confirm dating rumours","Popstar Katy Perry and former Canadian Prime Minister Justin Trudeau were spotted kissing on a yacht in California, seemingly confirming dating rumours. The vir..."
Will Trudeau resign? Four paths Canada's prime minister could take,A shock high-profile resignation has forced Canada's prime minister to contend with his plummeting popularity.
Sophie Trudeau Talks Love as Justin and Katy Perry's Romance Grows,Sophie Gregoire Trudeau opened up about grief and moving forward as ex-husband Justin Trudeau and Katy Perry's romance gains attention
Trudeau to shuffle cabinet Friday after Freeland’s resignation: sources - National,"Prime Minister Justin Trudeau will gather new cabinet appointees at Rideau Hall Friday morning to be sworn into their new positions, two sources told Global New..."
Canada's Prime Minister Justin Trudeau resigns as Liberal Party leader,Trudeau has been battling waning popularity and the specter of U.S. trade tariffs.
Trudeau says Canada will respond firmly to 'unacceptable' U.S. tariffs,"Prime Minister Justin Trudeau says Canada's response to the Trump administration's threatened 25 per cent tariffs on steel and aluminum will be clear and firm, ..."
Canadian PM Justin Trudeau to resign: What happens now?,"Canada's parliament will be suspended until 24 March while a new Liberal Party leader is chosen, Justin Trudeau said."
Most Liberals in caucus want Trudeau to go: MP,Longtime Trudeau loyalist Chandra Arya says it’s time for the prime minister to step aside — and he believes the majority of Liberals in caucus feel the sam...
Top Trudeau Ally Chrystia Freeland Resigns from Canadian Government,"Canadian Finance Minister Chrystia Freeland, Prime Minister Justin Trudeau's most powerful minister, announced Monday she was resigning."
Ex-central banker to replace Trudeau as Canada PM,"Carney defeated former cabinet minister Karina Gould, former finance minister and deputy prime minister Chrystia Freeland, and Businessman and former Liberal MP..."
Trudeau bites the dust – Winnipeg Free Press,"Breaking News, Sports, Manitoba, Canada"
"Trump calls Trudeau governor of ""great state of Canada""",Trump admitted on the weekend he can't guarantee the threatened tariffs won't raise prices for American consumers.
'What the Hell Kind of Shoes Does Trudeau Have On?',"Looks like every day is Casual Friday for Justin Trudeau now that he's no longer prime minister of Canada, as evidenced by what he opted to wear to King Charles..."
"Quebec Liberal caucus calling for Trudeau to resign, adding to pressure","The Liberal Party's Quebec caucus has joined the Atlantic and Ontario caucuses in calling on Justin Trudeau to resign, Global News has learned."
Canada's Trudeau Promises Trump 'Tougher Border Controls' During Florida Meet,"Canadian Prime Minister Justin Trudeau promised President-elect Donald Trump that Canada would toughen controls over the long undefended joint border, a senior ..."
Vacationing Trudeau can't escape catcalls and mockery: 'Get out of B.C.',Ski vacations used to go great for Prime Minister Justin Trudeau. Not this one. He was told to 'Please get the f--k out of B.C'
"Pierre Trudeau really, really loved communists | Canada Did What?!","He covered up famines for Red China, and wasn't all that pleased with Ukrainian independence"
Justin Trudeau Kissed a Girl and He Liked It!?,Justin Trudeau and Katy Perry are stirring up rumors of a summer romance. What's the truth?
Diplo Claims He Dated Both Katy Perry & Justin Trudeau,Diplo says he kissed Katy Perry's guy and he kinda liked it ... claiming he dated both Perry and former Canadian Prime Minister Justin Trudeau -- though it seem...
Trudeau calls idea of banning Trump from Canada ‘irresponsible’,"Breaking News, Sports, Manitoba, Canada"
Prime Minister Justin Trudeau will shuffle his cabinet tomorrow,A government source confirms a swearing-in ceremony will take place at Rideau Hall.
Prime Minister Trudeau meets Donald Trump at Mar-a-Lago,"Prime Minister Justin Trudeau landed in West Palm Beach, Fla., on Friday evening to meet with U.S.-president elect Donald Trump at Mar-a-Lago, sources confirm t..."
Justin Trudeau,"A source revealed all the details on Justin Trudeau and Katy Perry's date—including how they met, what they talked about, and future plans."
Katy Perry and Justin Trudeau spotted sharing a meal in Montreal,Katy Perry is currently on the Canadian leg of her Lifetimes tour.
"Trudeau exaggerated Nijjar murder, appeased Sikh extremists: Ex-Pentagon official",Former Pentagon official Michael Rubin slammed ex-Canadian PM Justin Trudeau over his blame-game on India over the killing of Khalistani terrorist Hardeep Singh...
Pro-Khalistan leader Jagmeet Singh vows to bring down Justin Trudeau government,Jagmeet Singh vowed to bring down Trudeau with Deputy Prime Minister and Finance Minister Chrystia Freeland’s resignation already having brought significant h...
Diplo: I Used to Date Katy Perry AND Justin Trudeau,"Diplo once dated Katy Perry, and abruptly announced on a podcast that he also once dated former PM Justin Trudeau. Is ... is he serious?"
Canadian PM Trudeau expected to announce resignation in coming days: report,Any decision would come amid a caucus revolt and dismal public opinion polls that show his party would likely lose in a landslide to the rival Conservatives.
"Trudeau Meets King Charles, with Trump’s ’51st State’ Comments at the Fore",Outgoing Canadian Prime Minister Justin Trudeau met with King Charles III in London on Monday.
Justin Trudeau Reveals the Comeback That Shut Down Trump’s ‘51st State’ Chatter,Justin Trudeau has revealed the quip that silenced Donald Trump’s taunting that Canada should become the “51st state” during his visit to Mar-a-Lago last ...
Amy Hamm: Trudeau is the furthest thing from a feminist,Women’s progress is under attack everywhere — and it is because of leaders like him
Are Katy Perry & Justin Trudeau Dating? Go Behind the Rumors,Katy Perry and Justin Trudeau sparked dating rumors in July 2025 after they were seen on a dinner date. Find out the nature of their relationship.
Watch live: Justin Trudeau delivers remarks on U.S. tariffs,Watch live coverage as Canadian Prime Minister Justin Trudeau delivers remarks on the U.S. tariffs and how Canada will respond to President Trump's policy.
Canada Deputy PM Resigns Over Tariff Rift With Justin Trudeau,Canada's Deputy Prime Minister Chrystia Freeland quit Monday in a surprise move after disagreeing with Justin Trudeau over US President-elect Donald Trump's tar...
