attitude,title,description
positive,"Katy Perry And Justin Trudeau Caught Kissing On A Yacht Amid Dating Rumours, Almost Confirm Relationship!",Katy Perry and actor Orlando Bloom ended their engagement after nearly a decade together.
negative,Scandalous affairs of world leaders: From Justin Trudeau to Bill Clinton– 5 shocking political romances,"Power, politics, and passion often collide — and history has proven that even the most powerful aren’t immune to matters of the heart. From secret romances ..."
positive,Smitten Justin Trudeau spotted in crowd at Katy Perry's concert with his daughter after viral date,"A photo circulating on social media purports to show Justin watching Katy's latest show with his daughter Ella Grace, 16, by his side."
positive,"Here’s What Justin Trudeau Did After He & Katy Perry Spent Time in Montreal, Says Source","Justin Trudeau and Katy Perry’s rumored relationship appears to be heating up, as he's “been pursuing her” since their meeting in Montreal."
positive,Orlando Bloom Reacts to Katy Perry and Justin Trudeau Dating Rumors,Orlando Bloom reacted to a satirical article jokingly linking him to Angela Merkel as Katy Perry and Justin Trudeau spark dating speculation
positive,Sophie Trudeau says she has learnt not to cling to ‘relationships’ after split with PM,Sophie Grégoire Trudeau has “learnt to cut ties” and “not cling to relationships” after the break-up of her marriage to the prime minister of Canada.
